{
  "schemaVersion": 1,
  "appVersion": "2.0.2",
  "title": "Interactive Context Engineering Lab",
  "disclaimer": "This lab provides deterministic, source-grounded practice feedback. It does not make legal, compliance, security, financial, or other professional determinations, and it does not use external AI grading.",
  "scenarios": [
    {
      "id": "lab-ch1-guided-support",
      "chapterId": "ch1",
      "chapterNumber": 1,
      "title": "Assemble a Grounded Subscription-Downgrade Context",
      "mode": "guided-assembly",
      "modeLabel": "Guided assembly",
      "summary": "Choose the smallest useful context package for a customer asking why a subscription was downgraded.",
      "scenario": "A customer asks why their subscription was downgraded. The response must use the official downgrade policy, the customer’s current account facts, and a friendly tone without speculation.",
      "instructions": "Select every component that belongs in the working context. Leave out material that does not help this bounded task.",
      "selection": {
        "minSelections": 1,
        "correctIds": [
          "role",
          "rules",
          "dynamic",
          "grounding",
          "task",
          "output"
        ],
        "options": [
          {
            "id": "role",
            "label": "Role: customer support agent",
            "description": "Defines the operating role for the response."
          },
          {
            "id": "rules",
            "label": "Rules: do not speculate; be concise; state when information is missing",
            "description": "Sets the no-invention and response boundaries."
          },
          {
            "id": "dynamic",
            "label": "Dynamic facts: account status, plan type, and current date",
            "description": "Provides the customer-specific current state."
          },
          {
            "id": "grounding",
            "label": "Grounding: the relevant downgrade rule and remediation options",
            "description": "Provides the approved evidence needed to explain the change."
          },
          {
            "id": "task",
            "label": "Task: explain this customer’s downgrade and provide next steps",
            "description": "Keeps the job bounded to the immediate request."
          },
          {
            "id": "output",
            "label": "Output: explanation, next steps, and missing information needed",
            "description": "Makes the answer scannable and reviewable."
          },
          {
            "id": "memory",
            "label": "Memory: the customer’s entire historical chat archive",
            "description": "This broad history is not required for the bounded task and may add noise."
          },
          {
            "id": "web",
            "label": "Tool: unrestricted public web search",
            "description": "The task should be grounded in approved policy and account facts, not open web content."
          },
          {
            "id": "example",
            "label": "Example: an unrelated refund email",
            "description": "An unrelated example consumes context without improving this answer."
          }
        ]
      },
      "rubric": [
        {
          "id": "bounded",
          "label": "The package is bounded to the downgrade question.",
          "support": "Chapter 1 asks for a role, constraints, dynamic facts, policy excerpts, and a structured output."
        },
        {
          "id": "grounded",
          "label": "Approved policy and account facts ground the answer.",
          "support": "The source scenario requires official policy plus current account status."
        },
        {
          "id": "no-invention",
          "label": "The rules prevent speculation and expose missing information.",
          "support": "The source scenario explicitly requires no speculation and a missing-information path."
        },
        {
          "id": "structured",
          "label": "The output contract contains explanation, next steps, and needed information.",
          "support": "The source scenario specifies these three output elements."
        }
      ],
      "provenance": [
        {
          "source": "Chapter_1_Foundations_of_AI_Context_Engineering.docx",
          "locator": "Practice: three mini-scenarios; Scenario 1, paragraphs P0131–P0138",
          "support": "Customer downgrade scenario, required role/constraints, dynamic facts, policy excerpts, and output structure."
        },
        {
          "source": "Reliable_Generative_AI_Context_Engineering_5_Playbooks.docx",
          "locator": "Purpose and scaling principle, pages 1–3",
          "support": "Use the same discipline at every scale while adding only proportionate structure."
        }
      ],
      "editorialStatus": "owner-source-grounded-for-iteration-10",
      "evaluation": {
        "criteria": [
          {
            "rubricId": "bounded",
            "requiredOptionIds": [
              "role",
              "task"
            ],
            "forbiddenOptionIds": [
              "memory",
              "web",
              "example"
            ]
          },
          {
            "rubricId": "grounded",
            "requiredOptionIds": [
              "dynamic",
              "grounding"
            ]
          },
          {
            "rubricId": "no-invention",
            "requiredOptionIds": [
              "rules"
            ]
          },
          {
            "rubricId": "structured",
            "requiredOptionIds": [
              "output"
            ]
          }
        ]
      }
    },
    {
      "id": "lab-ch2-missing-discovery",
      "chapterId": "ch2",
      "chapterNumber": 2,
      "title": "Find What Is Missing from a Billing Discovery Brief",
      "mode": "find-missing-context",
      "modeLabel": "Find the missing context",
      "summary": "Diagnose why “Help customers with billing” is not yet a testable context-engineering job.",
      "scenario": "A support team begins with the statement: “Help customers with billing.” The team has not agreed on users, approved evidence, constraints, success criteria, test cases, or what to do when information is missing.",
      "instructions": "Select the missing Discovery artifacts and decisions that must be defined before major prompt refinement.",
      "selection": {
        "minSelections": 1,
        "correctIds": [
          "bounded-job",
          "users",
          "sources",
          "rubric",
          "tests",
          "inventory",
          "missing-info"
        ],
        "options": [
          {
            "id": "bounded-job",
            "label": "A bounded job-to-be-done",
            "description": "Define the exact billing task and what the answer must enable."
          },
          {
            "id": "users",
            "label": "The intended users and useful response type",
            "description": "Clarify who will use the output and what form is useful."
          },
          {
            "id": "sources",
            "label": "Allowed and prohibited evidence sources",
            "description": "State which policy and account facts may ground the answer."
          },
          {
            "id": "rubric",
            "label": "A success rubric",
            "description": "Define accuracy, completeness, grounding, constraints, and usability before refinement."
          },
          {
            "id": "tests",
            "label": "Representative test cases",
            "description": "Include typical, tricky, incomplete, and escalation cases."
          },
          {
            "id": "inventory",
            "label": "An initial context inventory",
            "description": "List available instructions, evidence, dynamic facts, and other candidate context."
          },
          {
            "id": "missing-info",
            "label": "Missing-information and escalation behavior",
            "description": "Define what happens when approved evidence is insufficient."
          },
          {
            "id": "temperature",
            "label": "A preferred creativity temperature",
            "description": "This does not replace Discovery artifacts or a stable definition of success."
          },
          {
            "id": "marketing",
            "label": "The model provider’s marketing description",
            "description": "Provider marketing is not an artifact that defines this business task."
          },
          {
            "id": "developers",
            "label": "The number of developers available",
            "description": "Staffing does not define the job, evidence boundary, or rubric."
          }
        ]
      },
      "rubric": [
        {
          "id": "job",
          "label": "The broad ambition becomes a bounded operational task.",
          "support": "Chapter 2 contrasts “Help customers with billing” with an evaluable statement grounded in policy and account facts."
        },
        {
          "id": "standard",
          "label": "The standard of success is explicit before major prompt refinement.",
          "support": "Discovery creates the success rubric and representative cases used later in Evaluation."
        },
        {
          "id": "boundary",
          "label": "Evidence and missing-information boundaries are explicit.",
          "support": "Discovery asks what sources are allowed or prohibited and what happens when the model does not know enough."
        },
        {
          "id": "handoff",
          "label": "Later phases receive a stable set of artifacts.",
          "support": "The problem statement, users, rubric, test cases, and context inventory guide Selection and Shaping."
        }
      ],
      "provenance": [
        {
          "source": "Chapter_2_Context_Engineering_Lifecycle.docx",